{
  "$schema": "./workflow-graph-source.schema.json",
  "automatic_handoff_policy": {
    "ambiguity_stop": true,
    "max_automatic_handoffs": 3,
    "visited_set_required": true
  },
  "bootstrap_provenance": {
    "authority_after_import": "references/workflow-graph.source.json",
    "curation_overrides": [
      {
        "edges": [
          "launch-asset-packager--community-launch-runner",
          "launch-asset-packager--launch-readiness-auditor",
          "launch-asset-packager--press-media-relations"
        ],
        "field": "type",
        "id": "product-launch-fan-out",
        "reason": "The named Product Launch execution workflow starts three independent gated, community, and media lanes from the completed asset package.",
        "value": "fan-out"
      },
      {
        "edges": [
          "launch-readiness-auditor--launch-day-conductor"
        ],
        "field": "type",
        "id": "product-launch-ship-release-gate",
        "reason": "Launch-day execution opens only after a validator-clean RAMP SHIP verdict and a separate external-action approval; FIX, BLOCK, and UNDECIDED remain closed.",
        "value": "gate"
      },
      {
        "edges": [
          "community-launch-runner--launch-monitor",
          "launch-day-conductor--launch-monitor",
          "press-media-relations--launch-monitor"
        ],
        "field": "type",
        "id": "product-launch-evidence-join",
        "reason": "Launch monitoring must wait for evidence from the launch-day, community, and media lanes before the shared outcome window begins.",
        "value": "join"
      }
    ],
    "inference_rules": [
      "Only explicit SKILL.md links and exact backticked catalog skill IDs were imported.",
      "Each condition_text and condition_source is the normalized authored Next Best Skill line; a closed classifier assigns primary, conditional, alternate, quality-gate, governance, remediation, or explicit unclassified.",
      "Required-input and precondition codes are deterministically derived from the classified condition, edge type, permissions, and gate metadata.",
      "Auditor targets are gates; protocol targets are memory edges; cross-discipline targets are cross-discipline edges; same-discipline phase order supplies sequential or reentry types, subject to recorded curation overrides.",
      "Strongly connected edges use one-traversal visited-set policies under the graph-level three-handoff cap; cycles receive no blanket exceptions and earlier-phase reentries alone require an exception.",
      "Every node has an explicit natural-stop, terminal, or human-decision stopping policy."
    ],
    "method": "one-time-explicit-import",
    "note": "Markdown was used only to create the initial explicit edge inventory; normal generation never treats prose as authoritative.",
    "source_surface": "Markdown Next Best Skill declarations"
  },
  "catalog_version": "20.2.0",
  "edge_shards": [
    {
      "edge_count": 40,
      "first_edge_id": "ad-account-auditor--attribution-reconciler",
      "id": "edges-00",
      "last_edge_id": "campaign-architect--ad-creative-builder",
      "ref": "references/workflow-graph/edges-00.json",
      "sha256": "ecc142650657e11f0db93da0d935bc2b0f4acdae27cad5c88d6e7b79a330191a"
    },
    {
      "edge_count": 40,
      "first_edge_id": "campaign-architect--ad-test-designer",
      "id": "edges-01",
      "last_edge_id": "content-quality-auditor--technical-seo-checker",
      "ref": "references/workflow-graph/edges-01.json",
      "sha256": "48cfcf896ec1706f50b908aee71590388f23897c2ac0915256a9736670764b8a"
    },
    {
      "edge_count": 40,
      "first_edge_id": "content-writer--content-quality-auditor",
      "id": "edges-02",
      "last_edge_id": "email-creative-builder--email-quality-auditor",
      "ref": "references/workflow-graph/edges-02.json",
      "sha256": "e8cadc6b1deb38ffd81d846685857a987d544893dabd04fe3570613d3509b2f5"
    },
    {
      "edge_count": 40,
      "first_edge_id": "email-creative-builder--landing-optimizer",
      "id": "edges-03",
      "last_edge_id": "influencer-discovery--fit-scorer",
      "ref": "references/workflow-graph/edges-03.json",
      "sha256": "b809c2d830bfe0f515168be933a6eb34034fa7cbd5433bb09bdb440d218adc2d"
    },
    {
      "edge_count": 40,
      "first_edge_id": "keyword-research--competitor-analysis",
      "id": "edges-04",
      "last_edge_id": "list-growth-designer--email-sequence-designer",
      "ref": "references/workflow-graph/edges-04.json",
      "sha256": "6693a90856c1fd05a664c0c49a37508d9a86c7697ab3f0758d14689c4a1b3c47"
    },
    {
      "edge_count": 40,
      "first_edge_id": "list-growth-designer--landing-optimizer",
      "id": "edges-05",
      "last_edge_id": "narrative-enablement-kit--pitch-narrative-builder",
      "ref": "references/workflow-graph/edges-05.json",
      "sha256": "91a0a0ea92245f95360e54421a3454c7202e042de31b74c98f6397d9245bc55f"
    },
    {
      "edge_count": 40,
      "first_edge_id": "narrative-quality-auditor--message-system-architect",
      "id": "edges-06",
      "last_edge_id": "performance-analyzer--roi-calculator",
      "ref": "references/workflow-graph/edges-06.json",
      "sha256": "e7dacc20bdb99d2b0996e7ca3b9ecd5d4a2d0645e228fccb3f99fd7c0a24d666"
    },
    {
      "edge_count": 40,
      "first_edge_id": "performance-monitor--content-quality-auditor",
      "id": "edges-07",
      "last_edge_id": "roi-calculator--budget-optimizer",
      "ref": "references/workflow-graph/edges-07.json",
      "sha256": "5c6f8e3eba1db7f51484af75ab1d0427356745a770efdeea71868b7494130224"
    },
    {
      "edge_count": 40,
      "first_edge_id": "roi-calculator--performance-analyzer",
      "id": "edges-08",
      "last_edge_id": "story-bank-builder--narrative-cascade-planner",
      "ref": "references/workflow-graph/edges-08.json",
      "sha256": "b4c35b905f2836fdd309b04f42bbe944f441558b52a95bb2c9724286dd923eeb"
    },
    {
      "edge_count": 18,
      "first_edge_id": "story-bank-builder--offer-claims-registry",
      "id": "edges-09",
      "last_edge_id": "campaign-planner--performance-analyzer",
      "ref": "references/workflow-graph/edges-09.json",
      "sha256": "b047a123ec78458ac8e107ecd71e49dc3188cc7b32d7e00540bd41f09665ccb5"
    }
  ],
  "entrypoint_policy": "all-catalog-skills-directly-routable",
  "node_exceptions": [],
  "node_source": "references/system-catalog.json",
  "node_stopping_policies": [
    {
      "condition_codes": [
        "automatic-handoff-cap-reached",
        "owner-decision-required",
        "permission-required"
      ],
      "mode": "human-decision",
      "node": "ad-account-auditor"
    },
    {
      "condition_codes": [
        "automatic-handoff-cap-reached",
        "handoff-ambiguous",
        "objective-complete"
      ],
      "mode": "natural-stop",
      "node": "ad-creative-builder"
    },
    {
      "condition_codes": [
        "automatic-handoff-cap-reached",
        "handoff-ambiguous",
        "objective-complete"
      ],
      "mode": "natural-stop",
      "node": "ad-test-designer"
    },
    {
      "condition_codes": [
        "automatic-handoff-cap-reached",
        "handoff-ambiguous",
        "objective-complete"
      ],
      "mode": "natural-stop",
      "node": "advocacy-program-designer"
    },
    {
      "condition_codes": [
        "automatic-handoff-cap-reached",
        "handoff-ambiguous",
        "objective-complete"
      ],
      "mode": "natural-stop",
      "node": "attribution-reconciler"
    },
    {
      "condition_codes": [
        "automatic-handoff-cap-reached",
        "handoff-ambiguous",
        "objective-complete"
      ],
      "mode": "natural-stop",
      "node": "audience-belief-mapper"
    },
    {
      "condition_codes": [
        "automatic-handoff-cap-reached",
        "handoff-ambiguous",
        "objective-complete"
      ],
      "mode": "natural-stop",
      "node": "audience-mapper"
    },
    {
      "condition_codes": [
        "automatic-handoff-cap-reached",
        "handoff-ambiguous",
        "objective-complete"
      ],
      "mode": "natural-stop",
      "node": "audience-segment-builder"
    },
    {
      "condition_codes": [
        "automatic-handoff-cap-reached",
        "handoff-ambiguous",
        "objective-complete"
      ],
      "mode": "natural-stop",
      "node": "bid-strategy-planner"
    },
    {
      "condition_codes": [
        "automatic-handoff-cap-reached",
        "handoff-ambiguous",
        "objective-complete"
      ],
      "mode": "natural-stop",
      "node": "brand-language-codifier"
    },
    {
      "condition_codes": [
        "automatic-handoff-cap-reached",
        "handoff-ambiguous",
        "objective-complete"
      ],
      "mode": "natural-stop",
      "node": "brief-generator"
    },
    {
      "condition_codes": [
        "automatic-handoff-cap-reached",
        "handoff-ambiguous",
        "objective-complete"
      ],
      "mode": "natural-stop",
      "node": "budget-optimizer"
    },
    {
      "condition_codes": [
        "automatic-handoff-cap-reached",
        "handoff-ambiguous",
        "objective-complete"
      ],
      "mode": "natural-stop",
      "node": "budget-pacing-monitor"
    },
    {
      "condition_codes": [
        "automatic-handoff-cap-reached",
        "handoff-ambiguous",
        "objective-complete"
      ],
      "mode": "natural-stop",
      "node": "campaign-architect"
    },
    {
      "condition_codes": [
        "automatic-handoff-cap-reached",
        "handoff-ambiguous",
        "objective-complete"
      ],
      "mode": "natural-stop",
      "node": "campaign-planner"
    },
    {
      "condition_codes": [
        "automatic-handoff-cap-reached",
        "handoff-ambiguous",
        "objective-complete"
      ],
      "mode": "natural-stop",
      "node": "category-narrative-mapper"
    },
    {
      "condition_codes": [
        "automatic-handoff-cap-reached",